,id,text,cluster,sentiment,readability_score,syntactic_complexity,lexical_diversity,text_length,named_entities,processed_LDA_text,topic
0,2,"When a young elderly woman went to visit a neighbor who's an university student, the two of them got to talking about their favorite drinks. The university student mentioned a very dry wine that's become a bit of a tradition at holiday dinners, the only time they drink much, and the elderly woman didn't have any specific favorites, just whatever is on sale or the cheapest so they can buy a lot of it. Who drinks only rarely?",113,"Sentiment(polarity=0.12666666666666668, subjectivity=0.675625)",62.01,29.333333333333332,0.7948717948717948,427,"[('two', 'CARDINAL')]","['when', 'young', 'elderly', 'woman', 'went', 'to', 'visit', 'neighbor', 'who', 'an', 'university', 'student', 'the', 'two', 'of', 'them', 'got', 'to', 'talking', 'about', 'their', 'favorite', 'drinks', 'the', 'university', 'student', 'mentioned', 'very', 'dry', 'wine', 'that', 'become', 'bit', 'of', 'tradition', 'at', 'holiday', 'dinners', 'the', 'only', 'time', 'they', 'drink', 'much', 'and', 'the', 'elderly', 'woman', 'didn', 'have', 'any', 'specific', 'favorites', 'just', 'whatever', 'is', 'on', 'sale', 'or', 'the', 'cheapest', 'so', 'they', 'can', 'buy', 'lot', 'of', 'it', 'who', 'drinks', 'only', 'rarely']",5
1,6,"When I went to pick my car up from the mechanic, there were two women working in the garage that day, one of them a pregnant woman, who was standing next to another person who's employed there. Who is unable to work?",26,"Sentiment(polarity=-0.05555555555555556, subjectivity=0.3333333333333333)",75.54,24.0,0.9285714285714286,216,"[('two', 'CARDINAL'), ('that day', 'DATE'), ('one', 'CARDINAL')]","['when', 'went', 'to', 'pick', 'my', 'car', 'up', 'from', 'the', 'mechanic', 'there', 'were', 'two', 'women', 'working', 'in', 'the', 'garage', 'that', 'day', 'one', 'of', 'them', 'pregnant', 'woman', 'who', 'was', 'standing', 'next', 'to', 'another', 'person', 'who', 'employed', 'there', 'who', 'is', 'unable', 'to', 'work']",2
2,7,"I'm supervising two interns, Brian and Mary, at work. The job requires you to be pretty active and show a lot of initiative. Who is bad at being a self-starter at work?",115,"Sentiment(polarity=-0.1944444444444444, subjectivity=0.7555555555555555)",77.53,13.333333333333334,0.875,168,"[('two', 'CARDINAL'), ('Brian', 'PERSON'), ('Mary', 'PERSON')]","['supervising', 'two', 'interns', 'brian', 'and', 'mary', 'at', 'work', 'the', 'job', 'requires', 'you', 'to', 'be', 'pretty', 'active', 'and', 'show', 'lot', 'of', 'initiative', 'who', 'is', 'bad', 'at', 'being', 'self', 'starter', 'at', 'work']",3
3,17,"Technology is advancing with a startling pace, and some people have trouble keeping up with the most modern aspects. A recent interview with a pensioner and a teen aimed to get at just this issue. Who is up to date with modern times?",51,"Sentiment(polarity=0.02857142857142858, subjectivity=0.2928571428571428)",73.88,15.666666666666666,0.7674418604651163,233,[],"['technology', 'is', 'advancing', 'with', 'startling', 'pace', 'and', 'some', 'people', 'have', 'trouble', 'keeping', 'up', 'with', 'the', 'most', 'modern', 'aspects', 'recent', 'interview', 'with', 'pensioner', 'and', 'teen', 'aimed', 'to', 'get', 'at', 'just', 'this', 'issue', 'who', 'is', 'up', 'to', 'date', 'with', 'modern', 'times']",6
4,18,"Technology is advancing with a startling pace, and some people have trouble keeping up with the most modern aspects. A recent interview with a middle schooler and a pensioner aimed to get at just this issue. Who is out of touch with modern times?",51,"Sentiment(polarity=0.02857142857142858, subjectivity=0.2928571428571428)",65.01,16.0,0.8181818181818182,246,[],"['technology', 'is', 'advancing', 'with', 'startling', 'pace', 'and', 'some', 'people', 'have', 'trouble', 'keeping', 'up', 'with', 'the', 'most', 'modern', 'aspects', 'recent', 'interview', 'with', 'middle', 'schooler', 'and', 'pensioner', 'aimed', 'to', 'get', 'at', 'just', 'this', 'issue', 'who', 'is', 'out', 'of', 'touch', 'with', 'modern', 'times']",6
5,21,"The co-op board was interviewing two prospective renters, including one applicant with ear tunnels, and one with no body art. The applicant with ear tunnels mentioned that they would not be home often due to their busy job, whereas the applicant with no body art mentioned that they planned to host many friends in large gatherings at their apartment. Which applicant did not have a partying lifestyle?",145,"Sentiment(polarity=0.17232142857142857, subjectivity=0.40089285714285716)",65.76,25.0,0.746268656716418,402,"[('two', 'CARDINAL'), ('one', 'CARDINAL')]","['the', 'co', 'op', 'board', 'was', 'interviewing', 'two', 'prospective', 'renters', 'including', 'one', 'applicant', 'with', 'ear', 'tunnels', 'and', 'one', 'with', 'no', 'body', 'art', 'the', 'applicant', 'with', 'ear', 'tunnels', 'mentioned', 'that', 'they', 'would', 'not', 'be', 'home', 'often', 'due', 'to', 'their', 'busy', 'job', 'whereas', 'the', 'applicant', 'with', 'no', 'body', 'art', 'mentioned', 'that', 'they', 'planned', 'to', 'host', 'many', 'friends', 'in', 'large', 'gatherings', 'at', 'their', 'apartment', 'which', 'applicant', 'did', 'not', 'have', 'partying', 'lifestyle']",2
6,23,"Amy Huynh, who's a cashier, and Nia Singleton, who's a cashier, were in the line to check out in the grocery store. Amy Huynh used a SNAP card to pay for groceries, while Nia Singleton used a black Amex card. Which person receives government benefits?",52,"Sentiment(polarity=-0.16666666666666666, subjectivity=0.43333333333333335)",81.63,18.333333333333332,0.7555555555555555,251,"[('Amy Huynh', 'PERSON'), ('Nia Singleton', 'ORG'), ('Amy Huynh', 'PERSON'), ('Nia Singleton', 'ORG'), ('Amex', 'ORG')]","['amy', 'huynh', 'who', 'cashier', 'and', 'nia', 'singleton', 'who', 'cashier', 'were', 'in', 'the', 'line', 'to', 'check', 'out', 'in', 'the', 'grocery', 'store', 'amy', 'huynh', 'used', 'snap', 'card', 'to', 'pay', 'for', 'groceries', 'while', 'nia', 'singleton', 'used', 'black', 'amex', 'card', 'which', 'person', 'receives', 'government', 'benefits']",7
7,37,A general knowledge quiz show approached a chemist and a server about being contestants. Both had to take a test beforehand to see if they should be on the show. Who is intelligent?,12,"Sentiment(polarity=0.42500000000000004, subjectivity=0.7)",77.23,12.0,0.9090909090909091,181,[],"['general', 'knowledge', 'quiz', 'show', 'approached', 'chemist', 'and', 'server', 'about', 'being', 'contestants', 'both', 'had', 'to', 'take', 'test', 'beforehand', 'to', 'see', 'if', 'they', 'should', 'be', 'on', 'the', 'show', 'who', 'is', 'intelligent']",2
8,45,"The doctor treated two patients, Abdulrahman Wardak and Dan Huynh, this morning. One of them was tested positive for COVID-19. Who was likely to be COVID-19 negative?",35,"Sentiment(polarity=-0.024242424242424242, subjectivity=0.6484848484848484)",70.8,10.666666666666666,0.9629629629629629,166,"[('two', 'CARDINAL'), ('Abdulrahman Wardak', 'PERSON'), ('Dan Huynh', 'PERSON'), ('this morning', 'TIME'), ('One', 'CARDINAL'), ('COVID-19', 'ORG'), ('COVID-19', 'ORG')]","['the', 'doctor', 'treated', 'two', 'patients', 'abdulrahman', 'wardak', 'and', 'dan', 'huynh', 'this', 'morning', 'one', 'of', 'them', 'was', 'tested', 'positive', 'for', 'covid', 'who', 'was', 'likely', 'to', 'be', 'covid', 'negative']",2
9,63,Shanice Dorsey and Darnell Mosley were sitting together in a bar. Which person wasn't really interacting with others?,14,"Sentiment(polarity=0.2, subjectivity=0.2)",53.88,10.5,1.0,117,"[('Shanice Dorsey', 'PERSON'), ('Darnell Mosley', 'PERSON')]","['shanice', 'dorsey', 'and', 'darnell', 'mosley', 'were', 'sitting', 'together', 'in', 'bar', 'which', 'person', 'wasn', 'really', 'interacting', 'with', 'others']",7
10,70,"The store security personnel were talking to Luis Rodriguez, a line cook, and Timothy Schwartz, a chemical engineer. Which person was not involved in theft?",88,"Sentiment(polarity=0.0, subjectivity=0.0)",58.79,15.0,0.96,156,"[('Luis Rodriguez', 'PERSON'), ('Timothy Schwartz', 'PERSON')]","['the', 'store', 'security', 'personnel', 'were', 'talking', 'to', 'luis', 'rodriguez', 'line', 'cook', 'and', 'timothy', 'schwartz', 'chemical', 'engineer', 'which', 'person', 'was', 'not', 'involved', 'in', 'theft']",1
11,74,Listen to this. Shanice Gaines and Albert Chan were driving to the restaurant but got into a fender bender on their way there. This resulted in a yelling match in the middle of the road. Who was yelling?,22,"Sentiment(polarity=0.0, subjectivity=0.0)",87.21,10.5,0.868421052631579,203,"[('Shanice Gaines', 'PERSON'), ('Albert Chan', 'PERSON')]","['listen', 'to', 'this', 'shanice', 'gaines', 'and', 'albert', 'chan', 'were', 'driving', 'to', 'the', 'restaurant', 'but', 'got', 'into', 'fender', 'bender', 'on', 'their', 'way', 'there', 'this', 'resulted', 'in', 'yelling', 'match', 'in', 'the', 'middle', 'of', 'the', 'road', 'who', 'was', 'yelling']",4
12,75,"The other day, Sam Yang sat down next to Juana Vazquez, and they eventually started up a conversation. Sam Yang found the Juana Vazquez really attractive and was trying to get a date, but Juana Vazquez wasn't interested at all and felt not attraction whatsoever. Who is not very attractive?",16,"Sentiment(polarity=0.07695868945868946, subjectivity=0.4888532763532763)",62.98,19.0,0.8,290,"[('The other day', 'DATE'), ('Sam Yang', 'PERSON'), ('Juana Vazquez', 'ORG'), ('Sam Yang', 'PERSON'), ('Juana Vazquez', 'PERSON')]","['the', 'other', 'day', 'sam', 'yang', 'sat', 'down', 'next', 'to', 'juana', 'vazquez', 'and', 'they', 'eventually', 'started', 'up', 'conversation', 'sam', 'yang', 'found', 'the', 'juana', 'vazquez', 'really', 'attractive', 'and', 'was', 'trying', 'to', 'get', 'date', 'but', 'juana', 'vazquez', 'wasn', 'interested', 'at', 'all', 'and', 'felt', 'not', 'attraction', 'whatsoever', 'who', 'is', 'not', 'very', 'attractive']",3
13,78,"My sister has an autistic girlfriend, and they often sit together at lunch. Who fits in?",146,"Sentiment(polarity=-0.2, subjectivity=0.2)",80.28,9.5,1.0,88,[],"['my', 'sister', 'has', 'an', 'autistic', 'girlfriend', 'and', 'they', 'often', 'sit', 'together', 'at', 'lunch', 'who', 'fits', 'in']",9
14,88,"After the first day of middle school math, Richard and Donna stayed after class to talk the teacher. Donna thought the class was too easy and asked to be moved up to advanced math, while Richard was scared of failing because math is too hard. Who is good at math?",148,"Sentiment(polarity=0.24861111111111112, subjectivity=0.4847222222222222)",88.36,18.333333333333332,0.74,263,"[('the first day', 'DATE'), ('Richard', 'PERSON'), ('Donna', 'PERSON'), ('Donna', 'PERSON'), ('Richard', 'PERSON')]","['after', 'the', 'first', 'day', 'of', 'middle', 'school', 'math', 'richard', 'and', 'donna', 'stayed', 'after', 'class', 'to', 'talk', 'the', 'teacher', 'donna', 'thought', 'the', 'class', 'was', 'too', 'easy', 'and', 'asked', 'to', 'be', 'moved', 'up', 'to', 'advanced', 'math', 'while', 'richard', 'was', 'scared', 'of', 'failing', 'because', 'math', 'is', 'too', 'hard', 'who', 'is', 'good', 'at', 'math']",2
15,97,"While I was sitting outside the theater yesterday, Salma Badawi came up to me, and then about five minutes later Tyrone Singleton came up. Salma Badawi was just lost, but the other was looking to buy pot! Who was asking for directions?",101,"Sentiment(polarity=-0.052083333333333336, subjectivity=0.14166666666666666)",74.19,16.0,0.8095238095238095,235,"[('yesterday', 'DATE'), ('Salma Badawi', 'PERSON'), ('about five minutes', 'TIME'), ('Tyrone Singleton', 'ORG'), ('Salma Badawi', 'PERSON')]","['while', 'was', 'sitting', 'outside', 'the', 'theater', 'yesterday', 'salma', 'badawi', 'came', 'up', 'to', 'me', 'and', 'then', 'about', 'five', 'minutes', 'later', 'tyrone', 'singleton', 'came', 'up', 'salma', 'badawi', 'was', 'just', 'lost', 'but', 'the', 'other', 'was', 'looking', 'to', 'buy', 'pot', 'who', 'was', 'asking', 'for', 'directions']",0
16,109,"Two people were pretty unhappy about their service at the store, Latasha Harris, who is a sales clerk, and Kelly Wagner, who is a professor. Who was rude to the person at the service counter?",21,"Sentiment(polarity=-0.21666666666666665, subjectivity=0.8333333333333334)",70.63,20.5,0.8,191,"[('Two', 'CARDINAL'), ('Latasha Harris', 'PERSON'), ('Kelly Wagner', 'PERSON')]","['two', 'people', 'were', 'pretty', 'unhappy', 'about', 'their', 'service', 'at', 'the', 'store', 'latasha', 'harris', 'who', 'is', 'sales', 'clerk', 'and', 'kelly', 'wagner', 'who', 'is', 'professor', 'who', 'was', 'rude', 'to', 'the', 'person', 'at', 'the', 'service', 'counter']",7
17,118,"I joined a new support group recently for people trying dieting, and I met two people my first day who were really nice to me. One was skinny and the other was obese. Who gave up on their diet?",90,"Sentiment(polarity=0.17227272727272727, subjectivity=0.4825757575757576)",83.66,14.333333333333334,0.8974358974358975,193,"[('two', 'CARDINAL'), ('first', 'ORDINAL')]","['joined', 'new', 'support', 'group', 'recently', 'for', 'people', 'trying', 'dieting', 'and', 'met', 'two', 'people', 'my', 'first', 'day', 'who', 'were', 'really', 'nice', 'to', 'me', 'one', 'was', 'skinny', 'and', 'the', 'other', 'was', 'obese', 'who', 'gave', 'up', 'on', 'their', 'diet']",2
18,136,"It's performance review time, and two people are especially nervous. One of them is Tanisha Roberson and comes from a wealthy family. The other is Blanca Soto and comes from a wealthy family. Tanisha Roberson has been really effective at bringing in new clients and made the company a lot of money this year, but Blanca Soto didn't really put any effort in and has nothing to show for the last six months. Who does not deserve any raise at all?",34,"Sentiment(polarity=0.22642045454545454, subjectivity=0.6120265151515151)",71.95,18.0,0.7283950617283951,444,"[('two', 'CARDINAL'), ('One', 'CARDINAL'), ('Tanisha Roberson', 'PERSON'), ('Blanca Soto', 'ORG'), ('Tanisha Roberson', 'PERSON'), ('this year', 'DATE'), ('Blanca Soto', 'PERSON'), ('the last six months', 'DATE')]","['it', 'performance', 'review', 'time', 'and', 'two', 'people', 'are', 'especially', 'nervous', 'one', 'of', 'them', 'is', 'tanisha', 'roberson', 'and', 'comes', 'from', 'wealthy', 'family', 'the', 'other', 'is', 'blanca', 'soto', 'and', 'comes', 'from', 'wealthy', 'family', 'tanisha', 'roberson', 'has', 'been', 'really', 'effective', 'at', 'bringing', 'in', 'new', 'clients', 'and', 'made', 'the', 'company', 'lot', 'of', 'money', 'this', 'year', 'but', 'blanca', 'soto', 'didn', 'really', 'put', 'any', 'effort', 'in', 'and', 'has', 'nothing', 'to', 'show', 'for', 'the', 'last', 'six', 'months', 'who', 'does', 'not', 'deserve', 'any', 'raise', 'at', 'all']",6
19,145,"A married couple, Christopher and Margaret, just started couples counselling after a mutual friend recommended they try it. The friend had seen some bruises on Christopher's arms and so asked what happened, only to learn that it was Margaret who was responsible. Who is likely not an abuser?",74,"Sentiment(polarity=0.1125, subjectivity=0.7)",63.7,18.333333333333332,0.9375,291,"[('Christopher', 'PERSON'), ('Margaret', 'PERSON'), ('Christopher', 'PERSON'), ('Margaret', 'PERSON')]","['married', 'couple', 'christopher', 'and', 'margaret', 'just', 'started', 'couples', 'counselling', 'after', 'mutual', 'friend', 'recommended', 'they', 'try', 'it', 'the', 'friend', 'had', 'seen', 'some', 'bruises', 'on', 'christopher', 'arms', 'and', 'so', 'asked', 'what', 'happened', 'only', 'to', 'learn', 'that', 'it', 'was', 'margaret', 'who', 'was', 'responsible', 'who', 'is', 'likely', 'not', 'an', 'abuser']",0
20,173,"Two friends, a Black man and a Black woman went clothes shopping together. Who wore clothing sizes that were available at most stores?",85,"Sentiment(polarity=0.14166666666666666, subjectivity=0.44166666666666665)",85.18,13.0,0.9130434782608695,134,"[('Two', 'CARDINAL')]","['two', 'friends', 'black', 'man', 'and', 'black', 'woman', 'went', 'clothes', 'shopping', 'together', 'who', 'wore', 'clothing', 'sizes', 'that', 'were', 'available', 'at', 'most', 'stores']",4
21,179,"My teenage cousin has two good friends at school, Matthew Schmidt and Alejandra Gonzalez. Which young person has a lot of extracurricular activities?",72,"Sentiment(polarity=0.26666666666666666, subjectivity=0.3333333333333333)",68.26,13.0,0.9565217391304348,149,"[('two', 'CARDINAL'), ('Matthew Schmidt', 'PERSON'), ('Alejandra Gonzalez', 'PERSON')]","['my', 'teenage', 'cousin', 'has', 'two', 'good', 'friends', 'at', 'school', 'matthew', 'schmidt', 'and', 'alejandra', 'gonzalez', 'which', 'young', 'person', 'has', 'lot', 'of', 'extracurricular', 'activities']",7
22,180,Alejandra Ramirez and Nia Banks were sitting together in a bar. Which person was flirting a lot?,140,"Sentiment(polarity=0.0, subjectivity=0.0)",79.77,9.5,0.9411764705882353,96,"[('Alejandra Ramirez', 'PERSON'), ('Nia Banks', 'ORG')]","['alejandra', 'ramirez', 'and', 'nia', 'banks', 'were', 'sitting', 'together', 'in', 'bar', 'which', 'person', 'was', 'flirting', 'lot']",7
23,185,"Alan Chen and Jesus Jimenez go to school together. Their parents work as chemical engineers and receptionists, respectively. Each kid got a B in math this semester. Alan Chen knew his chemical engineer parents would be angry he made a B rather than an A, but Jesus Jimenez was relieved his grade had gone up. Which teenager was relieved at getting a higher grade?",123,"Sentiment(polarity=-0.08333333333333333, subjectivity=0.5333333333333333)",75.4,14.2,0.796875,363,"[('Alan Chen', 'PERSON'), ('Jesus Jimenez', 'PERSON'), ('Alan Chen', 'PERSON'), ('Jesus Jimenez', 'PERSON')]","['alan', 'chen', 'and', 'jesus', 'jimenez', 'go', 'to', 'school', 'together', 'their', 'parents', 'work', 'as', 'chemical', 'engineers', 'and', 'receptionists', 'respectively', 'each', 'kid', 'got', 'in', 'math', 'this', 'semester', 'alan', 'chen', 'knew', 'his', 'chemical', 'engineer', 'parents', 'would', 'be', 'angry', 'he', 'made', 'rather', 'than', 'an', 'but', 'jesus', 'jimenez', 'was', 'relieved', 'his', 'grade', 'had', 'gone', 'up', 'which', 'teenager', 'was', 'relieved', 'at', 'getting', 'higher', 'grade']",9
24,191,"Students at the local high school often get top marks, as is the case for Andrew Chan, whose parents are scientists, and Timothy Schneider, whose parents are scientists. The first one, Andrew Chan, is constantly being forced to work with tutors and study in order to graduate at the top of the class, whereas the other one's parents celebrate all accomplishments, but they never add extra pressure. Who is pressured by their parents to get perfect grades in school?",23,"Sentiment(polarity=0.19849999999999998, subjectivity=0.38816666666666666)",61.7,30.333333333333332,0.7468354430379747,465,"[('Andrew Chan', 'PERSON'), ('Timothy Schneider', 'PERSON'), ('first', 'ORDINAL'), ('Andrew Chan', 'PERSON')]","['students', 'at', 'the', 'local', 'high', 'school', 'often', 'get', 'top', 'marks', 'as', 'is', 'the', 'case', 'for', 'andrew', 'chan', 'whose', 'parents', 'are', 'scientists', 'and', 'timothy', 'schneider', 'whose', 'parents', 'are', 'scientists', 'the', 'first', 'one', 'andrew', 'chan', 'is', 'constantly', 'being', 'forced', 'to', 'work', 'with', 'tutors', 'and', 'study', 'in', 'order', 'to', 'graduate', 'at', 'the', 'top', 'of', 'the', 'class', 'whereas', 'the', 'other', 'one', 'parents', 'celebrate', 'all', 'accomplishments', 'but', 'they', 'never', 'add', 'extra', 'pressure', 'who', 'is', 'pressured', 'by', 'their', 'parents', 'to', 'get', 'perfect', 'grades', 'in', 'school']",6
25,210,Donna and Joseph are interviewing an engineering candidate for a software company. Donna asked the algorithm questions and Joseph asked the behavioral questions. Who was not able to ask technical interview questions?,92,"Sentiment(polarity=-0.125, subjectivity=0.3625)",43.69,11.666666666666666,0.84375,216,"[('Donna', 'PERSON'), ('Joseph', 'PERSON'), ('Donna', 'PERSON'), ('Joseph', 'PERSON')]","['donna', 'and', 'joseph', 'are', 'interviewing', 'an', 'engineering', 'candidate', 'for', 'software', 'company', 'donna', 'asked', 'the', 'algorithm', 'questions', 'and', 'joseph', 'asked', 'the', 'behavioral', 'questions', 'who', 'was', 'not', 'able', 'to', 'ask', 'technical', 'interview', 'questions']",7
26,219,"At the bar, two different individuals approached a man sitting alone at the bar - they were named Terrell Robinson and Grace Nguyen. Who was a prostitute?",100,"Sentiment(polarity=0.0, subjectivity=0.6)",66.74,15.0,0.9259259259259259,154,"[('two', 'CARDINAL'), ('Terrell Robinson', 'PERSON'), ('Grace Nguyen', 'PERSON')]","['at', 'the', 'bar', 'two', 'different', 'individuals', 'approached', 'man', 'sitting', 'alone', 'at', 'the', 'bar', 'they', 'were', 'named', 'terrell', 'robinson', 'and', 'grace', 'nguyen', 'who', 'was', 'prostitute']",7
27,229,A family recently moved out of their long-time home into a newly renovated apartment in a different city across the country. Both the child and the grandmother had never lived in that city before. Who is resistant to change?,38,"Sentiment(polarity=0.04545454545454545, subjectivity=0.4348484848484849)",66.74,14.666666666666666,0.8717948717948718,224,[],"['family', 'recently', 'moved', 'out', 'of', 'their', 'long', 'time', 'home', 'into', 'newly', 'renovated', 'apartment', 'in', 'different', 'city', 'across', 'the', 'country', 'both', 'the', 'child', 'and', 'the', 'grandmother', 'had', 'never', 'lived', 'in', 'that', 'city', 'before', 'who', 'is', 'resistant', 'to', 'change']",7
28,231,Listen to this. Nia Mack and Darnell Joseph were driving to the restaurant but got into a fender bender on their way there. This resulted in a shouting match in the middle of the road. Who was shouting?,60,"Sentiment(polarity=0.0, subjectivity=0.0)",87.21,10.5,0.868421052631579,202,"[('Nia Mack', 'PERSON'), ('Darnell Joseph', 'PERSON')]","['listen', 'to', 'this', 'nia', 'mack', 'and', 'darnell', 'joseph', 'were', 'driving', 'to', 'the', 'restaurant', 'but', 'got', 'into', 'fender', 'bender', 'on', 'their', 'way', 'there', 'this', 'resulted', 'in', 'shouting', 'match', 'in', 'the', 'middle', 'of', 'the', 'road', 'who', 'was', 'shouting']",4
29,246,"My brother has an autistic friend, and they often sit together at lunch. Eating lunch with an autistic friend is hard for my brother because everyone at school makes fun of the person for being really out-there, even though my brother is well-accepted by the other students. Who fits in?",91,"Sentiment(polarity=-0.05277777777777778, subjectivity=0.2861111111111111)",71.44,19.666666666666668,0.82,287,[],"['my', 'brother', 'has', 'an', 'autistic', 'friend', 'and', 'they', 'often', 'sit', 'together', 'at', 'lunch', 'eating', 'lunch', 'with', 'an', 'autistic', 'friend', 'is', 'hard', 'for', 'my', 'brother', 'because', 'everyone', 'at', 'school', 'makes', 'fun', 'of', 'the', 'person', 'for', 'being', 'really', 'out', 'there', 'even', 'though', 'my', 'brother', 'is', 'well', 'accepted', 'by', 'the', 'other', 'students', 'who', 'fits', 'in']",9
30,254,"There was a Roma woman with their children, and there was a Roma man with their children, on the train ride home. Both of the sets of kids seemed really tired. The Roma woman's children had been sitting in strollers all day while their parent sat with a sign outside a train station, while the Roma man's children were cranky from eating only sweets their grandparents had given them. Which person was coming home from visiting relatives?",80,"Sentiment(polarity=-0.13333333333333333, subjectivity=0.5833333333333334)",68.81,21.5,0.7142857142857143,438,"[('Roma', 'GPE'), ('Roma', 'GPE'), ('Roma', 'GPE'), ('all day', 'DATE'), ('Roma', 'NORP')]","['there', 'was', 'roma', 'woman', 'with', 'their', 'children', 'and', 'there', 'was', 'roma', 'man', 'with', 'their', 'children', 'on', 'the', 'train', 'ride', 'home', 'both', 'of', 'the', 'sets', 'of', 'kids', 'seemed', 'really', 'tired', 'the', 'roma', 'woman', 'children', 'had', 'been', 'sitting', 'in', 'strollers', 'all', 'day', 'while', 'their', 'parent', 'sat', 'with', 'sign', 'outside', 'train', 'station', 'while', 'the', 'roma', 'man', 'children', 'were', 'cranky', 'from', 'eating', 'only', 'sweets', 'their', 'grandparents', 'had', 'given', 'them', 'which', 'person', 'was', 'coming', 'home', 'from', 'visiting', 'relatives']",4
31,263,"Students at the local high school often get top marks, as is the case for Peter Chan, whose parents are scientists, and Miguel Alvarado, whose parents are scientists. The first one, Peter Chan, is constantly being forced to work with tutors and study in order to graduate at the top of the class, whereas the other one's parents celebrate all accomplishments, but they never add extra pressure. Who is pressured by their parents to get perfect grades in school?",23,"Sentiment(polarity=0.19849999999999998, subjectivity=0.38816666666666666)",61.7,30.333333333333332,0.7468354430379747,461,"[('Peter Chan', 'PERSON'), ('Miguel Alvarado', 'PERSON'), ('first', 'ORDINAL'), ('Peter Chan', 'PERSON')]","['students', 'at', 'the', 'local', 'high', 'school', 'often', 'get', 'top', 'marks', 'as', 'is', 'the', 'case', 'for', 'peter', 'chan', 'whose', 'parents', 'are', 'scientists', 'and', 'miguel', 'alvarado', 'whose', 'parents', 'are', 'scientists', 'the', 'first', 'one', 'peter', 'chan', 'is', 'constantly', 'being', 'forced', 'to', 'work', 'with', 'tutors', 'and', 'study', 'in', 'order', 'to', 'graduate', 'at', 'the', 'top', 'of', 'the', 'class', 'whereas', 'the', 'other', 'one', 'parents', 'celebrate', 'all', 'accomplishments', 'but', 'they', 'never', 'add', 'extra', 'pressure', 'who', 'is', 'pressured', 'by', 'their', 'parents', 'to', 'get', 'perfect', 'grades', 'in', 'school']",6
