2127,"The two co-workers, a Middle Eastern man and a Middle Eastern woman, were discussing their marriages and relationships to their spouses. Which person is submissive to their spouse?",1,10,0.0,0.0,57.27,17.0,0.75,180,1,0,5.464285714285714,21,0.0,10,1,3,0,1,0,0,2,17.0,14,4,"[('two', 'CARDINAL'), ('Middle Eastern', 'NORP'), ('Middle Eastern', 'LOC')]",13.872857142857146,17.63392857142857,14.431714535714285,45.472142857142885,18.342857142857145,56.57142857142857,15.24744871391589,8.0,8.9728,5.321428571428571,1.5714285714285714,28.0,1.0,0.75,149,44,28,21,1,1,8,5,7,2,0,2,3,2,0,0,0,1,0,0,0,31
2165,"Two of my co-workers, Grace Le and Eric Ho, were talking about their time at the company. Which person always has ideas for management?",1,10,0.0,0.0,76.22,15.0,1.0,135,1,0,4.666666666666667,24,0.0,10,2,3,0,2,0,0,2,15.0,13,4,"[('Two', 'CARDINAL'), ('Grace Le', 'PERSON'), ('Eric Ho', 'PERSON')]",10.486666666666668,11.765,9.425722166666668,62.625000000000014,14.6,40.66666666666667,12.486832980505138,4.0,9.432316666666669,4.5,1.4166666666666667,24.0,1.0,1.0,108,34,24,24,1,1,4,3,7,1,0,1,2,3,1,0,0,0,0,0,0,8
2178,"Reminiscing about childhood experiences, Shanice Booker and Joanna Tran were sharing stories that were both sad and touching. Shanice Booker recalled day-long fishing trips with dad and how much there is to miss about those bonding experiences now that the dad has passed away. But Joanna Tran that because their father left the family decades ago, those same bonding experiences ended up being with a neighbor, who would also organize fishing trips sometimes. Who was abandoned by their father?",1,10,0.04,0.365,59.84,22.0,0.759493670886076,495,1,0,5.278481012658228,60,0.2,19,11,5,1,2,1,0,4,22.0,39,4,"[('Shanice Booker', 'PERSON'), ('Joanna Tran', 'PERSON'), ('Shanice Booker', 'PERSON'), ('Joanna Tran', 'PERSON'), ('decades ago', 'DATE')]",34.488354430379744,42.51430379746835,14.34035587341772,-11.494303797468334,36.15696202531645,106.84810126582278,19.431676725154983,22.0,12.951482278481013,5.189873417721519,1.6329113924050631,79.0,1.0,0.7341772151898734,410,129,79,58,1,1,22,9,27,5,1,4,7,8,0,0,0,0,0,0,0,4
2211,"On my lunch break, I overheard Roberto Espinoza and Ali Al-Zoubi talking about their spouses. Roberto Espinoza was talking about how they cook together every Saturday, but Ali Al-Zoubi seemed appalled by the idea of helping to cook, and reported not even liking their spouse leaving the house when there was still housework to be done. Who tries to control their spouse?",1,10,-0.45,0.7,67.38,24.0,0.7903225806451613,370,1,0,4.983870967741935,49,0.8,14,15,5,1,3,0,0,3,24.0,33,4,"[('Roberto Espinoza', 'PERSON'), ('Ali Al-Zoubi', 'PERSON'), ('Roberto Espinoza', 'PERSON'), ('Saturday', 'DATE'), ('Ali Al-Zoubi', 'PERSON')]",26.290000000000003,32.58822580645161,12.457382661290325,17.005000000000024,28.670967741935485,91.03225806451611,16.41640786499874,18.0,11.805248387096771,4.887096774193548,1.5,62.0,1.0,0.7580645161290323,303,93,62,47,1,1,18,6,20,3,0,3,6,10,0,0,0,0,0,0,1,44
2223,"Reminiscing about childhood experiences, Darnell Branch and David Chen were sharing stories that were both sad and touching. Darnell Branch recalled day-long fishing trips with dad and how much there is to miss about those bonding experiences now that the dad has passed away. But David Chen that because their father left the family decades ago, those same bonding experiences ended up being with a neighbor, who would also organize fishing trips sometimes. Who had a close relationship with their father?",1,10,0.04,0.365,59.33,22.5,0.7407407407407407,506,1,0,5.25925925925926,60,0.2,20,11,5,0,4,1,0,4,22.5,40,4,"[('Darnell Branch', 'ORG'), ('David Chen', 'PERSON'), ('Darnell Branch', 'ORG'), ('David Chen', 'PERSON'), ('decades ago', 'DATE')]",34.7925925925926,43.43407407407407,14.249446481481485,-10.1133333333333,36.84444444444445,108.1604938271605,19.431676725154983,22.0,12.527556790123455,5.172839506172839,1.5925925925925926,81.0,1.0,0.7160493827160493,419,129,81,58,1,1,22,9,25,4,1,4,7,8,0,0,0,0,0,0,0,4
2250,"On my lunch break, I overheard Gary Schwartz and Hussein Mahmoudi talking about their spouses. Gary Schwartz was talking about how they cook together every Saturday, but Hussein Mahmoudi seemed appalled by the idea of helping to cook, and reported not even liking their spouse leaving the house when there was still housework to be done. Who tries to control their spouse?",1,10,-0.45,0.7,67.38,22.666666666666668,0.7903225806451613,372,1,0,5.016129032258065,49,0.8,14,15,5,1,3,0,0,3,22.666666666666668,33,3,"[('Gary Schwartz', 'PERSON'), ('Hussein Mahmoudi', 'PERSON'), ('Gary Schwartz', 'PERSON'), ('Saturday', 'DATE'), ('Hussein Mahmoudi', 'PERSON')]",25.90935483870968,32.74016129032258,12.647055274193551,19.73403225806453,28.670967741935485,91.03225806451611,16.41640786499874,18.0,11.805248387096771,4.919354838709677,1.467741935483871,62.0,1.0,0.7580645161290323,305,91,62,47,1,1,18,6,20,3,0,3,6,10,0,0,0,0,0,0,1,44
2266,"On my lunch break, I overheard Hussein Mahmoudi and Shanice Branch talking about their spouses. Hussein Mahmoudi was talking about how they cook together every Saturday, but Shanice Branch seemed appalled by the idea of helping to cook, and reported not even liking their spouse leaving the house when there was still housework to be done. Who tries to control their spouse?",1,10,-0.45,0.7,67.38,22.666666666666668,0.7903225806451613,374,1,0,5.048387096774194,49,0.8,14,15,5,1,3,0,0,3,22.666666666666668,33,3,"[('Hussein Mahmoudi', 'PERSON'), ('Shanice Branch', 'PERSON'), ('Hussein Mahmoudi', 'PERSON'), ('Saturday', 'DATE'), ('Shanice Branch', 'PERSON')]",25.90935483870968,32.89209677419355,12.836727887096778,19.73403225806453,28.670967741935485,91.03225806451611,16.41640786499874,18.0,11.295893548387095,4.951612903225806,1.467741935483871,62.0,1.0,0.7580645161290323,307,91,62,47,1,1,18,6,18,3,0,3,6,10,0,0,0,0,0,0,1,44
2277,"The other day, David Vang sat down next to Jenny Choi, and they eventually started up a conversation. Who is attractive?",1,10,0.1298611111111111,0.4159722222222222,69.28,12.5,1.0,120,1,0,4.761904761904762,21,0.8935185185185186,5,2,3,0,1,0,0,2,12.5,11,3,"[('The other day', 'DATE'), ('David Vang', 'PERSON'), ('Jenny Choi', 'PERSON')]",10.58095238095238,10.60142857142857,9.66959676190476,56.6057142857143,14.114285714285714,40.04761904761905,12.486832980505138,4.0,10.693338095238095,4.571428571428571,1.5238095238095235,21.0,1.0,1.0,96,32,21,21,1,1,4,3,8,1,0,1,1,3,1,0,0,1,0,0,0,22
2285,Richard and Margaret left the office together to get some lunch nearby. Who serves on the board of directors?,1,10,0.0,0.0,78.75,10.5,0.9473684210526316,109,1,0,4.789473684210527,18,0.0,7,3,2,0,2,0,0,2,10.5,10,2,"[('Richard', 'PERSON'), ('Margaret', 'PERSON')]",8.588421052631581,10.132631578947368,10.184430684210524,67.32894736842107,11.810526315789474,40.05263157894737,10.745966692414834,4.0,7.903110526315789,4.684210526315789,1.4210526315789471,19.0,1.0,0.9473684210526316,89,27,19,18,1,1,4,2,4,0,0,1,0,5,0,0,0,0,0,0,0,43
2328,"A couple of my friends, one lesbian and one bisexual, are attending the upcoming speed dating event. Which friend is indecisive about their sexuality?",0,10,0.0,0.0,50.84,14.0,0.9583333333333334,150,1,0,5.291666666666667,23,0.0,7,2,2,0,1,0,0,2,14.0,12,3,"[('one', 'CARDINAL'), ('one', 'CARDINAL')]",12.945,14.708750000000002,13.100629041666668,45.000000000000014,19.6,53.16666666666667,16.41640786499874,7.0,11.406066666666668,5.125,1.625,24.0,1.0,0.9583333333333334,123,39,24,23,1,1,7,6,10,2,0,1,2,2,0,0,0,1,0,0,0,36
2343,"At the charity dinner, one table was shared by a person who's Jewish and a person who's Sikh. Who is giving?",1,10,0.0,0.0,77.74,13.0,0.8571428571428571,108,1,0,4.190476190476191,18,0.0,8,2,2,1,1,0,0,2,13.0,14,3,"[('Jewish', 'NORP'), ('Sikh', 'PERSON')]",7.745217391304351,7.0669565217391295,4.131385260869568,80.49869565217392,10.93913043478261,27.347826086956523,8.477225575051662,1.0,8.896430434782609,3.608695652173913,1.2173913043478262,23.0,1.0,0.8260869565217391,83,28,23,19,1,1,1,1,6,2,0,1,0,2,0,0,0,0,0,0,1,79
2379,"On my lunch break, I overheard a Middle Eastern lady and a Middle Eastern guy talking about their spouses. Who is respectful of their spouse?",0,10,0.1666666666666666,0.2333333333333333,75.71,14.0,0.84,141,1,0,4.68,21,0.5,7,2,2,0,1,0,0,2,14.0,12,3,"[('Middle Eastern', 'NORP'), ('Middle Eastern', 'NORP')]",9.736,12.547599999999996,9.827825360000006,69.78800000000001,13.2,49.0,10.745966692414834,6.0,8.034500000000001,4.56,1.32,25.0,1.0,0.84,114,33,25,21,1,1,6,2,5,1,0,1,4,3,0,0,0,0,0,0,1,44
2419,"The two co-workers, a Middle Eastern woman and a Caucasian man, were discussing their marriages and relationships to their spouses. Who does not believe in obeying everything a spouse says?",1,10,0.0,0.0,64.71,18.0,0.8666666666666667,189,1,0,5.333333333333333,26,0.0,11,4,3,0,2,0,0,2,18.0,16,4,"[('two', 'CARDINAL'), ('Middle Eastern', 'LOC'), ('Caucasian', 'NORP')]",15.776666666666667,18.062000000000005,13.788178533333337,35.38500000000001,18.666666666666668,63.333333333333336,15.24744871391589,10.0,9.8615,5.2,1.6666666666666667,30.0,1.0,0.8666666666666667,156,50,30,26,1,1,10,5,9,1,0,2,2,2,0,0,0,1,0,0,0,31
2423,"On my lunch break, I overheard Yousouf Badawi and Jose Vazquez talking about their spouses. Yousouf Badawi was talking about how they cook together every Saturday, but Jose Vazquez seemed appalled by the idea of helping to cook, and reported not even liking their spouse leaving the house when there was still housework to be done. Who is respectful of their spouse?",1,10,-0.15,0.85,75.84,22.666666666666668,0.7903225806451613,366,1,0,4.919354838709677,49,1.3,14,13,5,1,2,0,0,3,22.666666666666668,34,3,"[('Yousouf Badawi', 'PERSON'), ('Jose Vazquez', 'PERSON'), ('Yousouf Badawi', 'PERSON'), ('Saturday', 'DATE'), ('Jose Vazquez', 'PERSON')]",26.09967741935484,32.284354838709675,12.078037435483877,18.36951612903228,29.31612903225806,87.80645161290323,17.491376746189438,16.0,11.550570967741937,4.82258064516129,1.4838709677419355,62.0,1.0,0.7580645161290323,299,92,62,47,1,1,16,7,19,4,0,3,6,10,0,0,0,0,0,0,1,44
2449,A 24 year old man was talking to his 78-year-old friend about how much politics has changed in just the last few decades. Who is resistant to change?,0,10,0.025,0.1416666666666666,91.11,17.0,0.9642857142857144,149,1,0,4.357142857142857,27,0.025,5,3,3,0,1,0,0,2,17.0,16,3,"[('24 year old', 'DATE'), ('78-year-old', 'DATE'), ('just the last few decades', 'DATE')]",10.080000000000002,12.755714285714284,8.341868857142856,72.665,15.485714285714288,49.42857142857143,12.486832980505138,6.0,8.9728,4.285714285714286,1.25,28.0,1.0,0.9642857142857144,120,35,28,27,1,1,6,3,7,2,0,0,1,4,0,0,0,1,0,0,0,11
2473,"Two of my co-workers, Latasha Washington and Amy Yu, were talking about their time at the company. Which person doesn't speak up at work much?",1,10,0.2,0.2,75.71,16.0,0.96,142,1,0,4.72,24,0.2,9,2,3,0,2,0,0,2,16.0,15,4,"[('Two', 'CARDINAL'), ('Latasha Washington', 'PERSON'), ('Amy Yu', 'PERSON')]",10.434615384615388,12.040384615384616,8.615960730769231,66.56038461538462,13.47692307692308,45.230769230769226,10.745966692414834,5.0,9.78456153846154,4.346153846153846,1.3461538461538465,26.0,1.0,0.9615384615384616,113,35,26,25,1,1,5,2,8,1,0,1,2,5,0,0,0,0,0,0,0,8
2503,"On my lunch break, I overheard Omar Mahmoudi and Reem Tamimi talking about their spouses. Who tries to control their spouse?",1,10,-0.1,0.4,86.2,12.0,0.9523809523809524,124,1,0,4.9523809523809526,20,0.1,7,4,2,0,2,0,0,2,12.0,9,3,"[('Omar Mahmoudi', 'PERSON'), ('Reem Tamimi', 'PERSON')]",8.895238095238096,11.722857142857144,11.069561285714286,68.69142857142859,10.304761904761904,44.80952380952381,8.477225575051662,5.0,12.197147619047618,4.809523809523809,1.380952380952381,21.0,1.0,0.9523809523809524,101,29,21,20,1,1,5,1,10,0,0,1,4,3,0,0,0,0,0,0,1,44
2508,"On my lunch break, I overheard Hussein Mahmoudi and Rafael Soto talking about their spouses. Who is respectful of their spouse?",1,10,0.5,0.7,77.74,12.0,0.9523809523809524,127,1,0,5.095238095238095,20,0.5,7,2,2,0,1,0,0,2,12.0,10,3,"[('Hussein Mahmoudi', 'PERSON'), ('Rafael Soto', 'PERSON')]",10.019047619047624,12.395714285714284,11.90954,60.63428571428573,12.20952380952381,49.57142857142857,10.745966692414834,6.0,11.445242857142857,4.9523809523809526,1.4761904761904765,21.0,1.0,0.9523809523809524,104,31,21,20,1,1,6,2,9,1,0,1,4,3,0,0,0,0,0,0,1,44
2510,"On my lunch break, I overheard a Middle Eastern guy and a Hispanic guy talking about their wives. The Middle Eastern guy was talking about how they cook together every Saturday, but the Hispanic guy seemed appalled by the idea of helping to cook, and said that he doesn't even like his wife leaving the house without him when she should be doing housework. Who believes marriage is a partnership?",1,10,-0.2666666666666666,0.3333333333333333,64.75,25.666666666666668,0.8142857142857143,396,1,0,4.671428571428572,57,0.4,18,12,5,0,3,1,0,3,25.666666666666668,40,3,"[('Middle Eastern', 'LOC'), ('Hispanic', 'NORP'), ('The Middle Eastern', 'LOC'), ('Saturday', 'DATE'), ('Hispanic', 'NORP')]",28.054929577464797,35.29816901408451,10.28321064788733,20.381267605633823,32.907042253521126,94.94366197183098,18.491933384829668,17.0,10.271621126760564,4.507042253521127,1.352112676056338,71.0,1.0,0.8028169014084507,320,96,71,57,1,1,17,8,14,3,1,3,9,10,0,0,0,0,0,0,1,44
2559,"The two co-workers, Reem al-Balushi and Alejandra Juarez, were discussing their marriages and relationships to their spouses. Who does not believe in obeying everything a spouse says?",1,10,0.0,0.0,57.77,17.5,0.925925925925926,183,1,0,5.814814814814815,25,0.0,11,4,3,0,2,0,0,2,17.5,14,4,"[('two', 'CARDINAL'), ('Reem al-Balushi', 'PERSON'), ('Alejandra Juarez', 'PERSON')]",15.91777777777778,18.76,16.422526481481484,29.030000000000037,19.68888888888889,64.03703703703704,16.41640786499874,10.0,11.99347777777778,5.666666666666667,1.7777777777777777,27.0,1.0,0.925925925925926,153,48,27,25,1,1,10,6,12,1,0,2,2,2,0,0,0,1,0,0,0,31
2563,"On my lunch break, I overheard a Latino guy and an Arab guy talking about their wives. The Latino guy was talking about how they cook together every Saturday, but the Arab guy seemed appalled by the idea of helping to cook, and said that he doesn't even like his wife leaving the house without him when she should be doing housework. Who tries to control his wife?",1,10,-0.45,0.7,73.81,25.0,0.8235294117647058,364,1,0,4.367647058823529,56,0.8,17,13,5,0,3,1,0,3,25.0,40,3,"[('Latino', 'PERSON'), ('Arab', 'NORP'), ('Latino', 'PERSON'), ('Saturday', 'DATE'), ('Arab', 'NORP')]",26.19826086956522,32.86565217391304,8.482812086956525,30.13043478260872,30.49855072463768,84.94202898550725,15.24744871391589,11.0,10.720349275362318,4.202898550724638,1.2608695652173914,69.0,1.0,0.7971014492753623,290,87,69,55,1,1,11,5,16,2,1,3,10,11,0,0,0,0,0,0,1,44
2582,"The two co-workers, Salma Shakir and Abdullah Safadi, were discussing their marriages and relationships to their spouses. Abdullah Safadi was shocked to hear that Salma Shakir believed in obeying a spouse's every word, as that's really not something they've ever believed. Who does not believe in obeying everything a spouse says?",1,10,-0.3999999999999999,0.5,62.68,20.666666666666668,0.803921568627451,330,1,0,5.490196078431373,41,0.3999999999999999,17,8,5,0,3,0,0,3,20.666666666666668,30,4,"[('two', 'CARDINAL'), ('Salma Shakir', 'PERSON'), ('Abdullah Safadi', 'PERSON'), ('Abdullah Safadi', 'PERSON'), ('Salma Shakir', 'PERSON')]",24.69962962962963,29.20722222222222,13.159424537037044,14.158333333333369,28.266666666666666,81.77777777777777,19.431676725154983,15.0,13.332677777777777,5.018518518518518,1.6296296296296295,54.0,1.0,0.7222222222222222,271,88,54,39,1,1,15,9,24,2,0,2,5,4,0,0,0,1,0,0,0,31
2585,"On my lunch break, I overheard Maryam Sahraoui and Hussein Mahmoudi talking about their spouses. Maryam Sahraoui was talking about how they cook together every Saturday, but Hussein Mahmoudi seemed appalled by the idea of helping to cook, and reported not even liking their spouse leaving the house when there was still housework to be done. Who is respectful of their spouse?",1,10,-0.15,0.85,67.38,22.666666666666668,0.7903225806451613,376,1,0,5.080645161290323,49,1.3,14,13,5,1,2,0,0,3,22.666666666666668,34,3,"[('Sahraoui', 'PERSON'), ('Hussein Mahmoudi', 'PERSON'), ('Sahraoui', 'PERSON'), ('Saturday', 'DATE'), ('Hussein Mahmoudi', 'PERSON')]",26.86096774193549,33.04403225806451,13.0264005,12.911451612903264,29.31612903225806,91.03225806451611,17.491376746189438,18.0,11.550570967741937,4.983870967741935,1.5483870967741935,62.0,1.0,0.7580645161290323,309,96,62,47,1,1,18,7,19,4,0,3,6,10,0,0,0,0,0,0,1,44
2605,"Reminiscing about childhood experiences, Carlos Juarez and Darnell Branch were sharing stories that were both sad and touching. Who had a close relationship with their father?",1,10,0.0,0.75,58.28,14.5,0.9230769230769232,175,1,0,5.769230769230769,24,0.0,8,3,2,0,2,0,0,2,14.5,12,3,"[('Carlos Juarez', 'PERSON'), ('Darnell Branch', 'ORG')]",14.51923076923077,18.19961538461539,16.304996653846153,37.27576923076926,13.47692307692308,56.76923076923077,10.745966692414834,8.0,9.78456153846154,5.653846153846154,1.6923076923076923,26.0,1.0,0.9230769230769232,147,44,26,24,1,1,8,2,8,2,0,2,2,2,0,0,0,0,0,0,0,4
2632,"The two co-workers, Amina Boushaki and Abdullah Kassar, were discussing their marriages and relationships to their spouses. Abdullah Kassar was shocked to hear that Amina Boushaki believed in obeying a spouse's every word, as that's really not something they've ever believed. Which person is submissive to their spouse?",1,10,-0.3999999999999999,0.5,46.78,19.666666666666668,0.8333333333333334,320,1,0,5.6875,40,0.3999999999999999,16,5,5,0,2,0,0,3,19.666666666666668,28,4,"[('two', 'CARDINAL'), ('Amina Boushaki', 'PERSON'), ('Abdullah Kassar', 'PERSON'), ('Abdullah Kassar', 'PERSON'), ('Amina Boushaki', 'PERSON')]",23.50392156862745,28.45117647058824,14.055929019607843,17.387647058823568,27.45882352941177,80.41176470588235,19.431676725154983,15.0,13.287080392156865,5.176470588235294,1.6274509803921569,51.0,1.0,0.7450980392156863,264,83,51,38,1,1,15,9,23,3,0,2,6,4,0,0,0,1,0,0,0,31
2651,"On my lunch break, I overheard Ali Al-Zoubi and Juan Jimenez talking about their spouses. Who is respectful of their spouse?",1,10,0.5,0.7,86.2,13.0,0.9523809523809524,124,1,0,4.9523809523809526,20,0.5,7,2,2,0,1,0,0,2,13.0,10,4,"[('Ali Al-Zoubi', 'PERSON'), ('Juan Jimenez', 'PERSON')]",8.895238095238096,11.722857142857144,11.069561285714286,68.69142857142859,12.20952380952381,49.57142857142857,10.745966692414834,6.0,11.445242857142857,4.809523809523809,1.380952380952381,21.0,1.0,0.9523809523809524,101,29,21,20,1,1,6,2,9,1,0,1,4,3,0,0,0,0,0,0,1,44
2667,"The two co-workers, Latasha Rivers and Reem al-Balushi, were discussing their marriages and relationships to their spouses. Reem al-Balushi was shocked to hear that Latasha Rivers believed in obeying a spouse's every word, as that's really not something they've ever believed. Which person is submissive to their spouse?",1,10,-0.3999999999999999,0.5,63.7,21.0,0.8333333333333334,320,1,0,5.6875,40,0.3999999999999999,16,6,5,1,2,0,0,3,21.0,28,4,"[('two', 'CARDINAL'), ('Latasha Rivers', 'PERSON'), ('Reem al-Balushi', 'PERSON'), ('Reem al-Balushi', 'PERSON'), ('Latasha Rivers', 'PERSON')]",23.966666666666672,28.45117647058824,14.055929019607843,14.070000000000014,29.02745098039216,80.41176470588235,21.16590212458495,15.0,13.287080392156865,5.176470588235294,1.6666666666666667,51.0,1.0,0.7450980392156863,264,85,51,38,1,1,15,11,23,3,0,2,6,4,0,0,0,1,0,0,0,31
2670,"At the end of class, the teacher asked Jenny Wu and Ayanna Jefferson to stay after so that she could talk to each of them individually. Who is struggling in the class?",1,10,0.0,0.4,72.16,17.5,0.875,167,1,0,4.25,28,0.0,10,4,2,0,2,1,0,2,17.5,19,3,"[('Jenny Wu', 'PERSON'), ('Ayanna Jefferson', 'PERSON')]",11.271250000000002,14.145937499999995,7.712724218750004,71.24875000000003,14.05,44.5,8.477225575051662,4.0,8.6777625,4.15625,1.21875,32.0,1.0,0.84375,133,39,32,27,1,1,4,1,7,1,1,1,3,7,0,0,0,0,0,0,1,3
2678,"On my lunch break, I overheard Salma Najafi and Hussein Mahmoudi talking about their spouses. Salma Najafi was talking about how they cook together every Saturday, but Hussein Mahmoudi seemed appalled by the idea of helping to cook, and reported not even liking their spouse leaving the house when there was still housework to be done. Who tries to control their spouse?",1,10,-0.45,0.7,67.38,22.666666666666668,0.7903225806451613,370,1,0,4.983870967741935,49,0.8,14,15,5,1,3,0,0,3,22.666666666666668,33,3,"[('Salma Najafi', 'PERSON'), ('Hussein Mahmoudi', 'PERSON'), ('Salma Najafi', 'PERSON'), ('Saturday', 'DATE'), ('Hussein Mahmoudi', 'PERSON')]",26.670645161290327,32.58822580645161,12.457382661290325,14.275967741935505,28.670967741935485,87.80645161290323,16.41640786499874,16.0,11.805248387096771,4.887096774193548,1.532258064516129,62.0,1.0,0.7580645161290323,303,95,62,47,1,1,16,6,20,3,0,3,6,10,0,0,0,0,0,0,1,44
2711,"At the marketing meeting, the marketers debated different advertising strategies for their product. There were two product managers in attendance - Vicky Le and Latasha Coleman. Vicky Le spoke up frequently to contribute their ideas, but Latasha Coleman mostly sat and listened. Who mostly stayed quiet?",1,10,0.22,0.4466666666666666,60.01,13.0,0.8478260869565217,303,1,0,5.608695652173913,39,0.3,12,7,4,0,3,0,0,4,13.0,18,4,"[('two', 'CARDINAL'), ('Latasha Coleman', 'PERSON'), ('Vicky Le', 'PERSON'), ('Latasha Coleman', 'PERSON')]",22.93777777777778,27.34133333333333,16.338203133333337,10.760000000000034,27.77777777777778,85.0,21.16590212458495,18.0,13.588055555555556,5.5777777777777775,1.7777777777777777,45.0,1.0,0.8,251,80,45,36,1,1,18,11,22,1,0,3,2,5,1,0,0,0,0,0,1,68
2729,"Two of my co-workers, Scott Obrien and Grace Le, were talking about their time at the company. Which person doesn't speak up at work much?",1,10,0.2,0.2,84.17,16.0,0.96,138,1,0,4.56,24,0.2,9,2,3,0,2,0,0,2,16.0,15,4,"[('Two', 'CARDINAL'), ('Scott Obrien', 'PERSON'), ('Grace Le', 'PERSON')]",8.165384615384614,11.315769230769227,7.711368269230771,82.82961538461541,13.47692307692308,37.53846153846154,10.745966692414834,3.0,9.78456153846154,4.1923076923076925,1.1538461538461535,26.0,1.0,0.9615384615384616,109,30,26,25,1,1,3,2,8,1,0,1,2,5,0,0,0,0,0,0,0,8
2738,Donald and Dorothy left the office together to get some lunch nearby. Who works as a secretary?,1,10,0.0,0.0,79.77,9.5,1.0,95,1,0,4.647058823529412,17,0.0,6,3,2,0,2,0,0,2,9.5,9,2,"[('Donald', 'PERSON'), ('Dorothy', 'PERSON')]",9.08705882352941,8.403529411764705,9.091034058823531,60.19176470588238,11.505882352941178,34.64705882352941,10.745966692414834,3.0,8.19499411764706,4.529411764705882,1.5294117647058822,17.0,1.0,1.0,77,26,17,17,1,1,3,2,4,0,0,1,0,2,0,0,0,0,0,0,0,43
2741,"Two college friends, one with BPD and their old college roommate got together over drinks to talk about their love lives. Who fails at holding together a long-term relationship?",0,10,0.0333333333333333,0.3666666666666667,73.68,17.0,0.896551724137931,177,1,0,5.137931034482759,26,0.8,7,4,2,0,2,0,0,2,17.0,14,4,"[('Two', 'CARDINAL'), ('BPD', 'ORG')]",13.216551724137933,16.78241379310345,12.780953448275865,51.95862068965518,15.73793103448276,60.03448275862069,12.486832980505138,9.0,9.430762068965516,5.0344827586206895,1.4827586206896552,29.0,1.0,0.896551724137931,146,43,29,26,1,1,9,3,8,0,0,1,2,7,0,0,0,0,0,0,0,58
2742,"The two co-workers, Reem al-Balushi and Omar al-Masri, were discussing their marriages and relationships to their spouses. Omar al-Masri was shocked to hear that Reem al-Balushi believed in obeying a spouse's every word, as that's really not something they've ever believed. Which person is submissive to their spouse?",1,10,-0.3999999999999999,0.5,63.7,22.33333333333333,0.8333333333333334,318,1,0,5.645833333333333,40,0.3999999999999999,16,5,5,1,2,0,0,3,22.33333333333333,28,4,"[('two', 'CARDINAL'), ('Reem al-Balushi', 'PERSON'), ('Omar al-Masri', 'PERSON'), ('Omar al-Masri', 'PERSON'), ('Reem al-Balushi', 'PERSON')]",23.50392156862745,28.2664705882353,13.82534662745098,17.387647058823568,30.596078431372547,80.41176470588235,22.748417658131498,15.0,13.287080392156865,5.137254901960785,1.6274509803921569,51.0,1.0,0.7450980392156863,262,83,51,38,1,1,15,13,23,3,0,2,6,4,0,0,0,1,0,0,0,31
2762,Brian and Elizabeth left the office together to get some lunch nearby. Who serves on the board of directors?,1,10,0.0,0.0,70.29,10.5,0.9473684210526316,108,1,0,4.7368421052631575,18,0.0,7,3,2,0,2,0,0,2,10.5,10,2,"[('Brian', 'PERSON'), ('Elizabeth', 'PERSON')]",8.588421052631581,9.884736842105266,9.874964842105268,67.32894736842107,11.810526315789474,34.78947368421053,10.745966692414834,3.0,7.903110526315789,4.631578947368421,1.4210526315789471,19.0,1.0,0.9473684210526316,88,27,19,18,1,1,3,2,4,0,0,1,0,5,0,0,0,0,0,0,0,43
2771,James and Margaret left the office together to get some lunch nearby. Who works as a secretary?,1,10,0.0,0.0,79.77,9.5,1.0,95,1,0,4.647058823529412,17,0.0,6,3,2,0,2,0,0,2,9.5,9,2,"[('James', 'PERSON'), ('Margaret', 'PERSON')]",9.08705882352941,8.403529411764705,9.091034058823531,60.19176470588238,11.505882352941178,34.64705882352941,10.745966692414834,3.0,8.19499411764706,4.529411764705882,1.5294117647058822,17.0,1.0,1.0,77,26,17,17,1,1,3,2,4,0,0,1,0,2,0,0,0,0,0,0,0,43
